{"entries":[{"canonical_field_id":"UOM-AVE-CT02","metadata":{"required":true,"scope":"FORMULA-02","type":"raw_text","unit":null},"occurrence_id":"occ-06be0fc602f9ae94749463573408c6d03177f000d4c8aac3b1a5c6911f45a07a","owner":{"grid_span":1,"kind":"cell","logical_column_end":5,"logical_column_start":5,"physical_cell":5,"row":3,"table":3,"vertical_merge":{"group_id":null,"state":"none"}},"raw_source_token":"<UOM-AVE-CT02>","template_sha256":"c492532054d9ba04d2dbd5c3d03706c423534cce5329d2657b2588760e0087e0","template_version":"po-fd-like-placeholder-template-v3-040826"},{"canonical_field_id":"THICKNESS-MIN-CT02","metadata":{"required":true,"scope":"FORMULA-02","type":"raw_text","unit":null},"occurrence_id":"occ-086577f8facf60b0aa82a1c896ae2d2a91f7657e9861fe1382f936c5d58754f6","owner":{"grid_span":1,"kind":"cell","logical_column_end":5,"logical_column_start":5,"physical_cell":5,"row":11,"table":3,"vertical_merge":{"group_id":null,"state":"none"}},"raw_source_token":"<THICKNESS-MIN-CT02>","template_sha256":"c492532054d9ba04d2dbd5c3d03706c423534cce5329d2657b2588760e0087e0","template_version":"po-fd-like-placeholder-template-v3-040826"},{"canonical_field_id":"AV-CT03","metadata":{"required":true,"scope":"FORMULA-03","type":"raw_text","unit":null},"occurrence_id":"occ-0e5e1acf60509b40fdb4affd8ff46fffefacfb6de2f3e4920dbff73602bb8c1c","owner":{"grid_span":1,"kind":"cell","logical_column_end":6,"logical_column_start":6,"physical_cell":5,"row":23,"table":3,"vertical_merge":{"group_id":null,"state":"none"}},"raw_source_token":"<AV-CT03>","template_sha256":"c492532054d9ba04d2dbd5c3d03706c423534cce5329d2657b2588760e0087e0","template_version":"po-fd-like-placeholder-template-v3-040826"},{"canonical_field_id":"PDS-180-150-CT03","metadata":{"required":true,"scope":"FORMULA-03","type":"raw_text","unit":null},"occurrence_id":"occ-1506f082e3d0da98719f8cdd309614d35059f840d8b3e415cc3bd533aff35be5","owner":{"grid_span":1,"kind":"cell","logical_column_end":6,"logical_column_start":6,"physical_cell":6,"row":6,"table":2,"vertical_merge":{"group_id":null,"state":"none"}},"raw_source_token":"<PDS-180-150-CT03>","template_sha256":"c492532054d9ba04d2dbd5c3d03706c423534cce5329d2657b2588760e0087e0","template_version":"po-fd-like-placeholder-template-v3-040826"},{"canonical_field_id":"UOM-AVE-CT01","metadata":{"required":true,"scope":"FORMULA-01","type":"raw_text","unit":null},"occurrence_id":"occ-16ee7f4c3eb9bdbbe38c8105292d2bce9fe8c902e1baa7aa2987cf2348317c7b","owner":{"grid_span":1,"kind":"cell","logical_column_end":4,"logical_column_start":4,"physical_cell":4,"row":3,"table":3,"vertical_merge":{"group_id":null,"state":"none"}},"raw_source_token":"<UOM-AVE-CT01>","template_sha256":"c492532054d9ba04d2dbd5c3d03706c423534cce5329d2657b2588760e0087e0","template_version":"po-fd-like-placeholder-template-v3-040826"},{"canonical_field_id":"API-CONTENT-CT01","metadata":{"required":true,"scope":"FORMULA-01","type":"raw_text","unit":null},"occurrence_id":"occ-16f5b58d279caa9585d957df4411e5307f55d4e23b3c2ae9f18950571e6dc5bf","owner":{"grid_span":1,"kind":"cell","logical_column_end":3,"logical_column_start":3,"physical_cell":3,"row":3,"table":1,"vertical_merge":{"group_id":null,"state":"none"}},"raw_source_token":"<API-CONTENT-CT01>","template_sha256":"c492532054d9ba04d2dbd5c3d03706c423534cce5329d2657b2588760e0087e0","template_version":"po-fd-like-placeholder-template-v3-040826"},{"canonical_field_id":"FRIABILITY-CT02","metadata":{"required":true,"scope":"FORMULA-02","type":"raw_text","unit":null},"occurrence_id":"occ-17e5474e93cc803b86c5c76dff31135470eaeb82d832e6a270d4b02e237f0def","owner":{"grid_span":1,"kind":"cell","logical_column_end":5,"logical_column_start":5,"physical_cell":4,"row":12,"table":3,"vertical_merge":{"group_id":null,"state":"none"}},"raw_source_token":"<FRIABILITY-CT02>","template_sha256":"c492532054d9ba04d2dbd5c3d03706c423534cce5329d2657b2588760e0087e0","template_version":"po-fd-like-placeholder-template-v3-040826"},{"canonical_field_id":"EXCIPIENT-4-%-CT02","metadata":{"required":true,"scope":"FORMULA-02","type":"raw_text","unit":null},"occurrence_id":"occ-1ab339f0b54a1085b6934636e284987a6d62ceb31f462e8da80f667d8ef465f6","owner":{"grid_span":1,"kind":"cell","logical_column_end":6,"logical_column_start":6,"physical_cell":6,"row":7,"table":1,"vertical_merge":{"group_id":null,"state":"none"}},"raw_source_token":"<EXCIPIENT-4-%-CT02>","template_sha256":"c492532054d9ba04d2dbd5c3d03706c423534cce5329d2657b2588760e0087e0","template_version":"po-fd-like-placeholder-template-v3-040826"},{"canonical_field_id":"DISSOLUTION-MAX-CT03","metadata":{"required":true,"scope":"FORMULA-03","type":"raw_text","unit":null},"occurrence_id":"occ-22061b1aef32801662711703876e47bfca8bb1a4600760b7567be5085a325670","owner":{"grid_span":1,"kind":"cell","logical_column_end":6,"logical_column_start":6,"physical_cell":6,"row":17,"table":3,"vertical_merge":{"group_id":null,"state":"none"}},"raw_source_token":"<DISSOLUTION-MAX-CT03>","template_sha256":"c492532054d9ba04d2dbd5c3d03706c423534cce5329d2657b2588760e0087e0","template_version":"po-fd-like-placeholder-template-v3-040826"},{"canonical_field_id":"ASSAY-CT03","metadata":{"required":true,"scope":"FORMULA-03","type":"raw_text","unit":null},"occurrence_id":"occ-233e809dcc680a4a923757adc34592a7be3323c1bdea33c63e21c7b0216c5f31","owner":{"grid_span":1,"kind":"cell","logical_column_end":6,"logical_column_start":6,"physical_cell":5,"row":15,"table":3,"vertical_merge":{"group_id":null,"state":"none"}},"raw_source_token":"<ASSAY-CT03>","template_sha256":"c492532054d9ba04d2dbd5c3d03706c423534cce5329d2657b2588760e0087e0","template_version":"po-fd-like-placeholder-template-v3-040826"},{"canonical_field_id":"EXCIPIENT-6","metadata":{"required":true,"scope":"all-formulations","type":"raw_text","unit":null},"occurrence_id":"occ-246a5f060cb6046fb4679b3f796385ef171eb507ea97c84e022a3a492765139e","owner":{"grid_span":1,"kind":"cell","logical_column_end":2,"logical_column_start":2,"physical_cell":2,"row":9,"table":1,"vertical_merge":{"group_id":null,"state":"none"}},"raw_source_token":"<EXCIPIENT-6>","template_sha256":"c492532054d9ba04d2dbd5c3d03706c423534cce5329d2657b2588760e0087e0","template_version":"po-fd-like-placeholder-template-v3-040826"},{"canonical_field_id":"EXCIPIENT-5-CONTENT-CT01","metadata":{"required":true,"scope":"FORMULA-01","type":"raw_text","unit":null},"occurrence_id":"occ-24d5355ff89e99300bdcbd4438efbc8db3e17a8059d8e327a2a83804c45873f8","owner":{"grid_span":1,"kind":"cell","logical_column_end":3,"logical_column_start":3,"physical_cell":3,"row":8,"table":1,"vertical_merge":{"group_id":null,"state":"none"}},"raw_source_token":"<EXCIPIENT-5-CONTENT-CT01>","template_sha256":"c492532054d9ba04d2dbd5c3d03706c423534cce5329d2657b2588760e0087e0","template_version":"po-fd-like-placeholder-template-v3-040826"},{"canonical_field_id":"TOTAL-IMPURITIES-SPEC","metadata":{"required":true,"scope":"all-formulations","type":"raw_text","unit":null},"occurrence_id":"occ-260e349774209ef3e9c950f5d5da1c6cc60f9f1653d43eda342d7113fe1d4b9d","owner":{"grid_span":2,"kind":"cell","logical_column_end":3,"logical_column_start":2,"physical_cell":2,"row":22,"table":3,"vertical_merge":{"group_id":null,"state":"none"}},"raw_source_token":"<TOTAL-IMPURITIES-SPEC>","template_sha256":"c492532054d9ba04d2dbd5c3d03706c423534cce5329d2657b2588760e0087e0","template_version":"po-fd-like-placeholder-template-v3-040826"},{"canonical_field_id":"API-CONTENT-CT03","metadata":{"required":true,"scope":"FORMULA-03","type":"raw_text","unit":null},"occurrence_id":"occ-2780c223587f2ed5230449e5e6c17fb2ed447d618f9a3ed3762ad950c3307093","owner":{"grid_span":1,"kind":"cell","logical_column_end":7,"logical_column_start":7,"physical_cell":7,"row":3,"table":1,"vertical_merge":{"group_id":null,"state":"none"}},"raw_source_token":"<API-CONTENT-CT03>","template_sha256":"c492532054d9ba04d2dbd5c3d03706c423534cce5329d2657b2588760e0087e0","template_version":"po-fd-like-placeholder-template-v3-040826"},{"canonical_field_id":"PDS-150-125-CT01","metadata":{"required":true,"scope":"FORMULA-01","type":"raw_text","unit":null},"occurrence_id":"occ-29d0f9f155bf907510514f4be28011b6aa08897534b3425563153709a712fcf7","owner":{"grid_span":1,"kind":"cell","logical_column_end":4,"logical_column_start":4,"physical_cell":4,"row":7,"table":2,"vertical_merge":{"group_id":null,"state":"none"}},"raw_source_token":"<PDS-150-125-CT01>","template_sha256":"c492532054d9ba04d2dbd5c3d03706c423534cce5329d2657b2588760e0087e0","template_version":"po-fd-like-placeholder-template-v3-040826"},{"canonical_field_id":"DISINTEGRATION-MIN-CT02","metadata":{"required":true,"scope":"FORMULA-02","type":"raw_text","unit":null},"occurrence_id":"occ-2a6eb90ffd6a86ca81138cd920d09e460507f565c5a0089f13fae9d2ec80aeef","owner":{"grid_span":1,"kind":"cell","logical_column_end":5,"logical_column_start":5,"physical_cell":5,"row":14,"table":3,"vertical_merge":{"group_id":null,"state":"none"}},"raw_source_token":"<DISINTEGRATION-MIN-CT02>","template_sha256":"c492532054d9ba04d2dbd5c3d03706c423534cce5329d2657b2588760e0087e0","template_version":"po-fd-like-placeholder-template-v3-040826"},{"canonical_field_id":"HARDNESS-AVE-CT03","metadata":{"required":true,"scope":"FORMULA-03","type":"raw_text","unit":null},"occurrence_id":"occ-2c492a8d052a5f42d485adcd183dd0141613fbf0028bb344a3c2a9782ee15fe1","owner":{"grid_span":1,"kind":"cell","logical_column_end":6,"logical_column_start":6,"physical_cell":6,"row":6,"table":3,"vertical_merge":{"group_id":null,"state":"none"}},"raw_source_token":"<HARDNESS-AVE-CT03>","template_sha256":"c492532054d9ba04d2dbd5c3d03706c423534cce5329d2657b2588760e0087e0","template_version":"po-fd-like-placeholder-template-v3-040826"},{"canonical_field_id":"EXCIPIENT-1-%-CT03","metadata":{"required":true,"scope":"FORMULA-03","type":"raw_text","unit":null},"occurrence_id":"occ-2e7c53a7427d3cd61de69b3892bdeb98a3331d4a1c511f1b46297d1674d3a1df","owner":{"grid_span":1,"kind":"cell","logical_column_end":8,"logical_column_start":8,"